"Sl No","Job Number","Start Date","End Date","Name of Work",Ward,Office,"Budget Head",Contractor,Mobile,Email,"Bill Type","Order Number","Order Date","SBR Number","SBR Date","BR Number","BR Date","CBR Number","CBR Date",Payment,Gross,"Gross In words",Deduction,"Deduction in words",Nett,"Nett in words"
78,196-19-000059,02-Aug-2019,24-Sep-2020,"Providing CC Road from Nice road to Tulsipura Govt School  in ward no 196 Anjanapura","o196 Anjanapura","Executive Engineer Bangalore South Division Bomanahalli Zone","P3400 Developmental works at ward No.75 Rs.20.00 Cr  and 29 Rs.10.00 Cr each and Ward No.32 Rs.7.00 Cr each","KRIDL BHUSIRI  ACCOU",0000000000,,"First and Final",000135,01-Aug-2019,000117,30-Sep-2020,000217,03-Oct-2020,,"           ","000039 / 29-Sep-2022 in RTGS",9934780,"Ninety Nine Lakh Thirty Four Thousand Seven Hundred Eighty ",1013975,"Ten Lakh Thirteen Thousand Nine Hundred Seventy Five",8920805,"Eighty Nine Lakh Twenty  Thousand Eight Hundred Five"
79,196-19-000065,01-Aug-2019,20-Aug-2020,"Providing water supply Pipe line i in ward no 196 Anjanapura","o196 Anjanapura","Executive Engineer Bangalore South Division Bomanahalli Zone","P3443 Developmental works at ward No.01,09,13,19,20,27,34,38,45,52,65,84,89,101,104,115,126,128,132,154,155,158.163,169,175, 181,184,185, 194,195, 196 Rs.02.00 Cr Each","KRIDL BHUSIRI  ACCOU",0000000000,,"First and Final",000134,01-Aug-2019,000108,10-Sep-2020,000200,24-Sep-2020,,"           ","000022 / 24-Aug-2022 in RTGS",4998040,"Fourty Nine Lakh Ninety Eight Thousand Fourty ",513715,"Five Lakh Thirteen Thousand Seven Hundred Fifteen",4484325,"Fourty Four Lakh Eighty Four Thousand Three Hundred Twenty Five"
80,196-19-000053,02-Aug-2019,28-Dec-2019,"Providing walking path and development of park near Narayananagara in ward no 196 Anjanapura","o196 Anjanapura","Executive Engineer Bangalore South Division Bomanahalli Zone","P3215 Development of New parks in New Zones  (Each zone Rs.6.CR civil works","KRIDL BHUSIRI  ACCOU",0000000000,,"First and Final",000129,01-Aug-2019,000084,31-Jul-2020,000163,05-Aug-2020,,"           ","000002 / 24-Aug-2022 in RTGS",6932400,"Sixty Nine Lakh Thirty Two Thousand Four Hundred ",702690,"Seven Lakh Two Thousand Six Hundred Ninety ",6229710,"Sixty Two Lakh Twenty Nine Thousand Seven Hundred Ten"
81,196-19-000057,02-Aug-2019,26-Dec-2019,"Improvements to roads in Tulsipura road in ward no 196 Anjanapura","o196 Anjanapura","Executive Engineer Bangalore South Division Bomanahalli Zone","P2573 Encouragement to Rural Sports (Marali ba Atada Maidhanakke) Dy Mayors discretionary","KRIDL BHUSIRI  ACCOU",0000000000,,"First and Final",000127,01-Aug-2019,000061,17-Jun-2020,000114,30-Jun-2020,,"           ","000193 / 21-Jun-2022 in RTGS",9930000,"Ninety Nine Lakh Thirty  Thousand ",1005340,"Ten Lakh Five Thousand Three Hundred Fourty ",8924660,"Eighty Nine Lakh Twenty Four Thousand Six Hundred Sixty "
82,196-19-000058,02-Aug-2019,26-Dec-2019,"Improvements to Drains in Tulsipura road in ward no 196 Anjanapura","o196 Anjanapura","Executive Engineer Bangalore South Division Bomanahalli Zone","P2573 Encouragement to Rural Sports (Marali ba Atada Maidhanakke) Dy Mayors discretionary","KRIDL BHUSIRI  ACCOU",0000000000,,"First and Final",000128,01-Aug-2019,000060,17-Jun-2020,000113,30-Jun-2020,,"           ","000193 / 21-Jun-2022 in RTGS",9939000,"Ninety Nine Lakh Thirty Nine Thousand ",1006130,"Ten Lakh Six Thousand One Hundred Thirty ",8932870,"Eighty Nine Lakh Thirty Two Thousand Eight Hundred Seventy "
83,196-19-000060,02-Aug-2019,28-Dec-2019,"Providing CC Drains  from Nice road to Tulsipura Govt School  in ward no 196 Anjanapura","o196 Anjanapura","Executive Engineer Bangalore South Division Bomanahalli Zone","P3400 Developmental works at ward No.75 Rs.20.00 Cr  and 29 Rs.10.00 Cr each and Ward No.32 Rs.7.00 Cr each","KRIDL BHUSIRI  ACCOU",0000000000,,"First and Final",000136,01-Aug-2019,000059,17-Jun-2020,000100,25-Jun-2020,,"           ","000183 / 18-Jun-2022 in RTGS",9938000,"Ninety Nine Lakh Thirty Eight Thousand ",1006130,"Ten Lakh Six Thousand One Hundred Thirty ",8931870,"Eighty Nine Lakh Thirty One Thousand Eight Hundred Seventy "
84,196-19-000052,02-Aug-2019,02-Mar-2020,"Providing walking path and development of park near Royal Park layout in ward no 196 Anjanapura","o196 Anjanapura","Executive Engineer Bangalore South Division Bomanahalli Zone","P3215 Development of New parks in New Zones  (Each zone Rs.6.CR civil works","KRIDL BHUSIRI  ACCOU",0000000000,,"First and Final",000132,01-Aug-2019,000103,19-Mar-2020,000339,31-Mar-2020,,"           ","000115 / 19-May-2022 in RTGS",2970000,"Twenty Nine Lakh Seventy  Thousand ",304110,"Three Lakh Four Thousand One Hundred Ten",2665890,"Twenty Six Lakh Sixty Five Thousand Eight Hundred Ninety "
85,196-19-000054,02-Aug-2019,30-Oct-2019,"Providing walking path and development of park near Tippu Circle  in ward no 196 Anjanapura","o196 Anjanapura","Executive Engineer Bangalore South Division Bomanahalli Zone","P3215 Development of New parks in New Zones  (Each zone Rs.6.CR civil works","KRIDL BHUSIRI  ACCOU",0000000000,,"First and Final",000131,01-Aug-2019,000105,19-Mar-2020,000340,31-Mar-2020,,"           ","000115 / 19-May-2022 in RTGS",6402785,"Sixty Four Lakh Two Thousand Seven Hundred Eighty Five",651560,"Six Lakh Fifty One Thousand Five Hundred Sixty ",5751225,"Fifty Seven Lakh Fifty One Thousand Two Hundred Twenty Five"
86,196-19-000124,25-Jul-2019,30-Dec-2019,"Maintenance of Boreweils at Gollahali Kempathalli and Elethotadapalya in Ward No. 196","o196 Anjanapura","Executive Engineer Bangalore South Division Bomanahalli Zone","P1771 Zone Works - POW Works","Mr  ARUN KUMAR  C",8105863335,,"First and Final",000095,25-Jul-2019,000051,15-Jun-2020,000087,16-Jun-2020,,"           ","000180 / 17-Jun-2022 in RTGS",916300,"Nine Lakh Sixteen Thousand Three Hundred ",82720,"Eighty Two Thousand Seven Hundred Twenty ",833580,"Eight Lakh Thirty Three Thousand Five Hundred Eighty "
87,196-19-000126,25-Jul-2019,30-Dec-2019,"Maintenance of Boreweils at Narayana Nagar Kaveri layout and Balaji layout in Ward No. 196","o196 Anjanapura","Executive Engineer Bangalore South Division Bomanahalli Zone","P1771 Zone Works - POW Works","Mr  ARUN KUMAR  C",8105863335,,"First and Final",000096,25-Jul-2019,000052,15-Jun-2020,000088,16-Jun-2020,,"           ","000180 / 17-Jun-2022 in RTGS",916300,"Nine Lakh Sixteen Thousand Three Hundred ",82720,"Eighty Two Thousand Seven Hundred Twenty ",833580,"Eight Lakh Thirty Three Thousand Five Hundred Eighty "
88,196-19-000127,25-Jul-2019,30-Dec-2019,"Maintenance of Boreweils at Avalahalli BDA Quatres and Ashraya Colony in Ward No. 196","o196 Anjanapura","Executive Engineer Bangalore South Division Bomanahalli Zone","P1771 Zone Works - POW Works","Mr  ARUN KUMAR  C",8105863335,,"First and Final",000097,25-Jul-2019,000053,15-Jun-2020,000089,16-Jun-2020,,"           ","000180 / 17-Jun-2022 in RTGS",1377525,"Thirteen Lakh Seventy Seven Thousand Five Hundred Twenty Five",124325,"One Lakh Twenty Four Thousand Three Hundred Twenty Five",1253200,"Twelve Lakh Fifty Three Thousand Two Hundred "
89,196-19-000128,26-Jul-2019,20-Sep-2019,"Providing UGD Missed links in Ward No. 196","o196 Anjanapura","Executive Engineer Bangalore South Division Bomanahalli Zone","P1771 Zone Works - POW Works","UDAY KUMAR K",8904079096,,"First and Final",000098,25-Jul-2019,000063,21-Sep-2019,000183,25-Sep-2019,,"           ","000378 / 24-Feb-2022 in RTGS",3603440,"Thirty Six Lakh Three Thousand Four Hundred Fourty ",412055,"Four Lakh Twelve Thousand Fifty Five",3191385,"Thirty One Lakh Ninety One Thousand Three Hundred Eighty Five"
90,196-19-000130,26-Jul-2019,19-Sep-2019,"Providing Asphalting to Seethana house Sorrounding area in Ward No. 196","o196 Anjanapura","Executive Engineer Bangalore South Division Bomanahalli Zone","P1771 Zone Works - POW Works","UDAY KUMAR K",8904079096,,"First and Final",000099,25-Jul-2019,000064,21-Sep-2019,000184,25-Sep-2019,,"           ","000378 / 24-Feb-2022 in RTGS",3596490,"Thirty Five Lakh Ninety Six Thousand Four Hundred Ninety ",447285,"Four Lakh Fourty Seven Thousand Two Hundred Eighty Five",3149205,"Thirty One Lakh Fourty Nine Thousand Two Hundred Five"
91,196-19-000041,19-Jul-2020,10-Oct-2019,"Providing CC roads   at  Harinagara in Anjanapura ward 196","o196 Anjanapura","Executive Engineer Bangalore South Division Bomanahalli Zone","P0190 Works sanctioned by Hon Mayor","ESHWARAIAH B        ",9880413927,,"First and Final",000059,18-Jul-2019,000083,31-Jul-2020,000164,05-Aug-2020,,"           ","000003 / 24-Aug-2022 in RTGS",4471500,"Fourty Four Lakh Seventy One Thousand Five Hundred ",494280,"Four Lakh Ninety Four Thousand Two Hundred Eighty ",3977220,"Thirty Nine Lakh Seventy Seven Thousand Two Hundred Twenty "
92,196-19-000039,19-Jul-2019,16-Oct-2019,"Providing CC roads at Avalahalli in Anjanapura ward 196","o196 Anjanapura","Executive Engineer Bangalore South Division Bomanahalli Zone","P0190 Works sanctioned by Hon Mayor","ESHWARAIAH B        ",9880413927,,"First and Final",000058,18-Jul-2019,000104,19-Mar-2020,000338,31-Mar-2020,,"           ","000115 / 19-May-2022 in RTGS",4475350,"Fourty Four Lakh Seventy Five Thousand Three Hundred Fifty ",542985,"Five Lakh Fourty Two Thousand Nine Hundred Eighty Five",3932365,"Thirty Nine Lakh Thirty Two Thousand Three Hundred Sixty Five"
93,196-19-000125,13-Jul-2019,30-Dec-2019,"Maintenance of Boreweils at Anjanapura and Kidwai layout in Ward No. 196","o196 Anjanapura","Executive Engineer Bangalore South Division Bomanahalli Zone","P1771 Zone Works - POW Works",HANUMANTHARAYA,9980010778,,"First and Final",000039,12-Jul-2019,000048,11-Jun-2020,000115,30-Jun-2020,,"           ","000193 / 21-Jun-2022 in RTGS",828005,"Eight Lakh Twenty Eight Thousand Five",75715,"Seventy Five Thousand Seven Hundred Fifteen",752290,"Seven Lakh Fifty Two Thousand Two Hundred Ninety "
94,196-18-000090,22-Jun-2019,30-Dec-2019,"Filling of Pothole in ward no 196","o196 Anjanapura","Executive Engineer Bangalore South Division Bomanahalli Zone","P1771 Zone Works - POW Works","UDAY KUMAR K",8904079096,,"First and Final",000023,21-Jun-2019,000049,11-Jun-2020,000117,30-Jun-2020,,"           ","000193 / 21-Jun-2022 in RTGS",1836120,"Eighteen Lakh Thirty Six Thousand One Hundred Twenty ",201720,"Two Lakh One Thousand Seven Hundred Twenty ",1634400,"Sixteen Lakh Thirty Four Thousand Four Hundred "
95,196-20-000015,12-Apr-2019,18-Apr-2019,"Providing Assured Minimum Facilities AMF to all polling Stations of Loksabha Election 2019 pertains to Ward No 196","o196 Anjanapura","Executive Engineer Bangalore South Division Bomanahalli Zone","P0054 Election expenses","Cheluvaraju D",8497856286,,"First and Final",000018,18-Jun-2019,000041,21-Jun-2019,000097,29-Jun-2019,005762,14-Oct-2019,"000223 / 16-Oct-2019 in RTGS",240240,"Two Lakh Fourty  Thousand Two Hundred Fourty ",5265,"Five Thousand Two Hundred Sixty Five",234975,"Two Lakh Thirty Four Thousand Nine Hundred Seventy Five"
96,196-19-000117,08-Mar-2019,30-Jul-2019,"Construction of Toilet at Dhobhi Ghat premises at Anjanapura in ward no 196","o196 Anjanapura","Executive Engineer Project Division Bomanahalli Zone","P3112 Swacha Bharatha Abhiyana Grant Works","B CHANDRASHEKHAR",9999999999,,"First and Final",000032,07-Mar-2019,000011,31-Jul-2019,000011,31-Jul-2019,,"           ","000176 / 27-Aug-2021 in RTGS",1036227,"Ten Lakh Thirty Six Thousand Two Hundred Twenty Seven",97232,"Ninety Seven Thousand Two Hundred Thirty Two",938995,"Nine Lakh Thirty Eight Thousand Nine Hundred Ninety Five"
97,196-19-000051,06-Mar-2019,03-May-2019,"Development works at Anjanapura  ward no 196","o196 Anjanapura","Executive Engineer Bangalore South Division Bomanahalli Zone","P3400 Developmental works at ward No.75 Rs.20.00 Cr  and 29 Rs.10.00 Cr each and Ward No.32 Rs.7.00 Cr each",Venkatakrishna,7259032791,,"First and Final",000221,06-Mar-2019,000033,11-Jun-2019,000091,28-Jun-2019,,"           ","000220 / 04-Oct-2021 in RTGS",5185700,"Fifty One Lakh Eighty Five Thousand Seven Hundred ",646035,"Six Lakh Fourty Six Thousand Thirty Five",4539665,"Fourty Five Lakh Thirty Nine Thousand Six Hundred Sixty Five"
98,196-19-000116,06-Mar-2019,03-May-2019,"Providing CC roads at Avalahalli BDA Qtrs in Anjanapura ward no 196","o196 Anjanapura","Executive Engineer Bangalore South Division Bomanahalli Zone","P0190 Works sanctioned by Hon Mayor",Venkatakrishna,7259032791,,"First and Final",000220,06-Mar-2019,000034,11-Jun-2019,000092,28-Jun-2019,,"           ","000220 / 04-Oct-2021 in RTGS",5176400,"Fifty One Lakh Seventy Six Thousand Four Hundred ",645745,"Six Lakh Fourty Five Thousand Seven Hundred Fourty Five",4530655,"Fourty Five Lakh Thirty  Thousand Six Hundred Fifty Five"
99,196-19-000023,21-Feb-2019,17-Sep-2019,"Improvements roads and drains in Balaji Layout  Narayana Nagara 2nd Block at Anjanapura  in ward no 196","o196 Anjanapura","Executive Engineer Bangalore South Division Bomanahalli Zone","P3521 Developmental works at ward No.01, 03, 04, 11, 66, 71, 99, 110, 116, 118, 120, 126, 145, 152, 155, 177, 179,182, 194,  196 Rs.3.00 Cr each","KRIDL BHUSIRI  ACCOU",0000000000,,"First and Final",000184,21-Feb-2019,000070,26-Sep-2019,000205,25-Oct-2019,,"           ","000005 / 06-Apr-2022 in RTGS",4974080,"Fourty Nine Lakh Seventy Four Thousand Eighty ",708895,"Seven Lakh Eight Thousand Eight Hundred Ninety Five",4265185,"Fourty Two Lakh Sixty Five Thousand One Hundred Eighty Five"
100,196-19-000024,21-Feb-2019,28-Mar-2019,"Improvements roads and drains in Narayana Nagara 2nd block 13th and 14th cross at Anjanapura  in ward no 196","o196 Anjanapura","Executive Engineer Bangalore South Division Bomanahalli Zone","P3521 Developmental works at ward No.01, 03, 04, 11, 66, 71, 99, 110, 116, 118, 120, 126, 145, 152, 155, 177, 179,182, 194,  196 Rs.3.00 Cr each","M/s KRIDL",9845183166,,"First and Final",000185,21-Feb-2019,000015,02-May-2019,000060,14-May-2019,,"           ","000115 / 23-Jul-2021 in RTGS",4957350,"Fourty Nine Lakh Fifty Seven Thousand Three Hundred Fifty ",713995,"Seven Lakh Thirteen Thousand Nine Hundred Ninety Five",4243355,"Fourty Two Lakh Fourty Three Thousand Three Hundred Fifty Five"
101,196-19-000001,21-Feb-2019,29-Mar-2019,"Improvements to roads and drains at Bacchegowda Layout  in ward no 196","o196 Anjanapura","Executive Engineer Bangalore South Division Bomanahalli Zone","P2178 Works sanctioned by Dy. Mayor","M/s KRIDL",9845183166,,"First and Final",000194,21-Feb-2019,000001,04-Apr-2019,000033,30-Apr-2019,,"           ","000111 / 19-Jul-2021 in RTGS",4956400,"Fourty Nine Lakh Fifty Six Thousand Four Hundred ",713826,"Seven Lakh Thirteen Thousand Eight Hundred Twenty Six",4242574,"Fourty Two Lakh Fourty Two Thousand Five Hundred Seventy Four"
102,196-19-000005,21-Feb-2019,30-Mar-2019,"Improvements to roads and drains at KIDWAI Layout Cross roads   in ward no 196","o196 Anjanapura","Executive Engineer Bangalore South Division Bomanahalli Zone","P2178 Works sanctioned by Dy. Mayor","M/s KRIDL",9845183166,,"First and Final",000197,21-Feb-2019,000005,04-Apr-2019,000036,30-Apr-2019,,"           ","000111 / 19-Jul-2021 in RTGS",4953890,"Fourty Nine Lakh Fifty Three Thousand Eight Hundred Ninety ",713514,"Seven Lakh Thirteen Thousand Five Hundred Fourteen",4240376,"Fourty Two Lakh Fourty  Thousand Three Hundred Seventy Six"
103,196-19-000006,21-Feb-2019,27-Mar-2019,"Improvements to roads and drains at KIDWAI Layout Main  roads   in ward no 196","o196 Anjanapura","Executive Engineer Bangalore South Division Bomanahalli Zone","P2178 Works sanctioned by Dy. Mayor","M/s KRIDL",9845183166,,"First and Final",000198,21-Feb-2019,000006,04-Apr-2019,000032,30-Apr-2019,,"           ","000111 / 19-Jul-2021 in RTGS",4954940,"Fourty Nine Lakh Fifty Four Thousand Nine Hundred Fourty ",713636,"Seven Lakh Thirteen Thousand Six Hundred Thirty Six",4241304,"Fourty Two Lakh Fourty One Thousand Three Hundred Four"
104,196-19-000018,21-Feb-2019,29-Mar-2019,"Improvements to roads and drains at Balance roads in Narayan Nagara in ward no 196","o196 Anjanapura","Executive Engineer Bangalore South Division Bomanahalli Zone","P2415 Reserve fund for TandF Committee","M/s KRIDL",9845183166,,"First and Final",000190,21-Feb-2019,000002,04-Apr-2019,000034,30-Apr-2019,,"           ","000111 / 19-Jul-2021 in RTGS",4954940,"Fourty Nine Lakh Fifty Four Thousand Nine Hundred Fourty ",713636,"Seven Lakh Thirteen Thousand Six Hundred Thirty Six",4241304,"Fourty Two Lakh Fourty One Thousand Three Hundred Four"
105,196-19-000020,21-Feb-2019,28-Mar-2019,"Improvements roads and drainsin Annapoorneshwari layout 9th Cross at Anjanapura  in ward no 196","o196 Anjanapura","Executive Engineer Bangalore South Division Bomanahalli Zone","P3521 Developmental works at ward No.01, 03, 04, 11, 66, 71, 99, 110, 116, 118, 120, 126, 145, 152, 155, 177, 179,182, 194,  196 Rs.3.00 Cr each","M/s KRIDL",9845183166,,"First and Final",000182,21-Feb-2019,000003,04-Apr-2019,000035,30-Apr-2019,,"           ","000111 / 19-Jul-2021 in RTGS",4955860,"Fourty Nine Lakh Fifty Five Thousand Eight Hundred Sixty ",714636,"Seven Lakh Fourteen Thousand Six Hundred Thirty Six",4241224,"Fourty Two Lakh Fourty One Thousand Two Hundred Twenty Four"
106,196-18-000018,15-Feb-2019,02-Dec-2020,"Construction of ward offices in ward no 196 Anjanapura","o196 Anjanapura","Executive Engineer Bangalore South Division Bomanahalli Zone","P1808 Construction of Ward Offices","UDAY KUMAR K",8904079096,,"First and Final",000180,14-Feb-2019,000076,24-Sep-2021,000189,24-Sep-2021,,"           ","Under Process in Addl. Commr. Finance",9121450,"Ninety One Lakh Twenty One Thousand Four Hundred Fifty ",689714,"Six Lakh Eighty Nine Thousand Seven Hundred Fourteen",8431736,"Eighty Four Lakh Thirty One Thousand Seven Hundred Thirty Six"
107,196-18-000098,27-May-2020,31-Mar-2021,"Providing Asphalting to Srinidhi layout 12th 13th  and 14th Cross roads in ward no 196","o196 Anjanapura","Executive Engineer Bangalore South Division Bomanahalli Zone","P1771 Zone Works - POW Works","Mr  ARUN KUMAR  C",8105863335,,"First and Final",000175,07-Feb-2019,000019,19-May-2021,000051,19-May-2021,,"           ","Under Process in Addl. Commr. Finance",2046050,"Twenty  Lakh Fourty Six Thousand Fifty ",188876,"One Lakh Eighty Eight Thousand Eight Hundred Seventy Six",1857174,"Eighteen Lakh Fifty Seven Thousand One Hundred Seventy Four"
108,196-18-000103,26-Jun-2020,02-Dec-2020,"Providing Asphalting at Classic layout road in ward no 196","o196 Anjanapura","Executive Engineer Bangalore South Division Bomanahalli Zone","P1771 Zone Works - POW Works","Mr  ARUN KUMAR  C",8105863335,,"First and Final",000177,07-Feb-2019,000166,10-Dec-2020,000327,11-Dec-2020,,"           ","000186 / 19-Jan-2023 in RTGS",2292640,"Twenty Two Lakh Ninety Two Thousand Six Hundred Fourty ",253730,"Two Lakh Fifty Three Thousand Seven Hundred Thirty ",2038910,"Twenty  Lakh Thirty Eight Thousand Nine Hundred Ten"
109,196-18-000100,21-Jun-2020,14-Aug-2020,"Improvements to roads and drains at Patel Narayanappa layout in ward no 196","o196 Anjanapura","Executive Engineer Bangalore South Division Bomanahalli Zone","P1771 Zone Works - POW Works","ODWOLF INFRASTRUCTUR",9945631557,,"First and Final",000176,07-Feb-2019,000114,22-Sep-2020,000201,24-Sep-2020,,"           ","000023 / 24-Aug-2022 in RTGS",2552600,"Twenty Five Lakh Fifty Two Thousand Six Hundred ",307880,"Three Lakh Seven Thousand Eight Hundred Eighty ",2244720,"Twenty Two Lakh Fourty Four Thousand Seven Hundred Twenty "
110,196-18-000101,02-Feb-2019,23-Mar-2019,"Improvements CC roads in Muneshwara nagara 3rd Block in ward no 196","o196 Anjanapura","Executive Engineer Bangalore South Division Bomanahalli Zone","P1771 Zone Works - POW Works","S S Joshi",9886986426,,"First and Final",000174,02-Feb-2019,000160,26-Mar-2019,000439,29-Mar-2019,,"           ","000100 / 05-Jul-2021 in RTGS",2878450,"Twenty Eight Lakh Seventy Eight Thousand Four Hundred Fifty ",346605,"Three Lakh Fourty Six Thousand Six Hundred Five",2531845,"Twenty Five Lakh Thirty One Thousand Eight Hundred Fourty Five"
111,196-19-000047,26-Dec-2018,15-Mar-2019,"Improvements to Ashraya Colony Cross roads and Masjidi Oppsite roads in Ward No 196 Anjanapura","o196 Anjanapura","Executive Engineer Bangalore South Division Bomanahalli Zone","P1878 18per - Works (Bhagyajyothi, Sooru / Neeru Yojane and General) (54 Lakhs / New Wards)","M/s KRIDL",9845183166,,"First and Final",000137,26-Dec-2018,000010,27-Apr-2019,000046,04-May-2019,003309,04-Jul-2019,"000112 / 12-Jul-2019 in RTGS",9914160,"Ninety Nine Lakh Fourteen Thousand One Hundred Sixty ",1427830,"Fourteen Lakh Twenty Seven Thousand Eight Hundred Thirty ",8486330,"Eighty Four Lakh Eighty Six Thousand Three Hundred Thirty "
112,196-19-000048,26-Dec-2018,16-Feb-2019,"Improvements to CC roads and drains from Ravi House to Babu house cross roads and Main roads in Harinagara  Ward No 196 Anjanapura","o196 Anjanapura","Executive Engineer Bangalore South Division Bomanahalli Zone","P1878 18per - Works (Bhagyajyothi, Sooru / Neeru Yojane and General) (54 Lakhs / New Wards)","M/s KRIDL",9845183166,,"First and Final",000138,26-Dec-2018,000150,27-Feb-2019,000427,02-Mar-2019,003290,04-Jul-2019,"000112 / 12-Jul-2019 in RTGS",9913360,"Ninety Nine Lakh Thirteen Thousand Three Hundred Sixty ",1426990,"Fourteen Lakh Twenty Six Thousand Nine Hundred Ninety ",8486370,"Eighty Four Lakh Eighty Six Thousand Three Hundred Seventy "
113,196-19-000049,26-Dec-2018,16-Feb-2019,"Improvements to CC roads and drains from Banashankari Provision Store to Sampangi ramanna House to Harinagara in Ward No 196 Anjanapura","o196 Anjanapura","Executive Engineer Bangalore South Division Bomanahalli Zone","P1878 18per - Works (Bhagyajyothi, Sooru / Neeru Yojane and General) (54 Lakhs / New Wards)","M/s KRIDL",9845183166,,"First and Final",000139,26-Dec-2018,000151,27-Feb-2019,000426,01-Mar-2019,003308,04-Jul-2019,"000112 / 12-Jul-2019 in RTGS",9913120,"Ninety Nine Lakh Thirteen Thousand One Hundred Twenty ",1426950,"Fourteen Lakh Twenty Six Thousand Nine Hundred Fifty ",8486170,"Eighty Four Lakh Eighty Six Thousand One Hundred Seventy "
114,196-19-000046,26-Dec-2018,16-Jan-2019,"Improvements to Roads and Drains Thippasandra main road to Ganganna House in Ward No 196 Anjanapura","o196 Anjanapura","Executive Engineer Bangalore South Division Bomanahalli Zone","P1878 18per - Works (Bhagyajyothi, Sooru / Neeru Yojane and General) (54 Lakhs / New Wards)","M/s KRIDl",9845183166,,"First and Final",000136,26-Dec-2018,000144,21-Jan-2019,000399,04-Feb-2019,001910,22-May-2019,"000067 / 01-Jun-2019 in RTGS",9914190,"Ninety Nine Lakh Fourteen Thousand One Hundred Ninety ",1414305,"Fourteen Lakh Fourteen Thousand Three Hundred Five",8499885,"Eighty Four Lakh Ninety Nine Thousand Eight Hundred Eighty Five"
115,196-18-000093,07-Oct-2018,10-Dec-2021,"Maintenance of Borewells at Anjanapura and Kidwai layout in ward no 196","o196 Anjanapura","Executive Engineer Bangalore South Division Bomanahalli Zone","P1771 Zone Works - POW Works","Mr  ARUN KUMAR  C",8105863335,,"First and Final",000124,06-Oct-2018,000114,24-Feb-2022,000277,25-Feb-2022,,"           ","Under Process in Addl. Commr. Finance",1034700,"Ten Lakh Thirty Four Thousand Seven Hundred ",110431,"One Lakh Ten Thousand Four Hundred Thirty One",924269,"Nine Lakh Twenty Four Thousand Two Hundred Sixty Nine"
116,196-18-000121,03-Mar-2018,29-May-2018,"Improvements to roads and drains of main roads in Pushpak Layout in ward no 196","o196 Anjanapura","Executive Engineer Bangalore South Division Bomanahalli Zone","P3075 Special comprehensive development works in Bangalore city (Bangalore city in charge Minister Discretionary Grants)","M/s KRIDL",9632229990,,"First and Final",000103,18-Sep-2018,000114,17-Oct-2018,000288,31-Oct-2018,002025,17-Jul-2020,"000254 / 15-Jan-2021 in RTGS",4994400,"Fourty Nine Lakh Ninety Four Thousand Four Hundred ",727500,"Seven Lakh Twenty Seven Thousand Five Hundred ",4266900,"Fourty Two Lakh Sixty Six Thousand Nine Hundred "
117,196-18-000122,03-Mar-2018,29-May-2018,"Improvements to roads and drains of cross roads in Pushpak Layout in ward no 196","o196 Anjanapura","Executive Engineer Bangalore South Division Bomanahalli Zone","P3075 Special comprehensive development works in Bangalore city (Bangalore city in charge Minister Discretionary Grants)","M/s KRIDL",9632229990,,"First and Final",000101,18-Sep-2018,000113,17-Oct-2018,000284,31-Oct-2018,002029,17-Jul-2020,"000254 / 15-Jan-2021 in RTGS",4494930,"Fourty Four Lakh Ninety Four Thousand Nine Hundred Thirty ",646550,"Six Lakh Fourty Six Thousand Five Hundred Fifty ",3848380,"Thirty Eight Lakh Fourty Eight Thousand Three Hundred Eighty "
118,196-18-000123,03-Mar-2018,29-May-2018,"Improvements to roads and drains of Baskar  Layout in ward no 196","o196 Anjanapura","Executive Engineer Bangalore South Division Bomanahalli Zone","P3075 Special comprehensive development works in Bangalore city (Bangalore city in charge Minister Discretionary Grants)","M/s KRIDL",9632229990,,"First and Final",000102,18-Sep-2018,000112,17-Oct-2018,000287,31-Oct-2018,002024,17-Jul-2020,"000254 / 15-Jan-2021 in RTGS",4499600,"Fourty Four Lakh Ninety Nine Thousand Six Hundred ",656970,"Six Lakh Fifty Six Thousand Nine Hundred Seventy ",3842630,"Thirty Eight Lakh Fourty Two Thousand Six Hundred Thirty "
119,196-17-000062,08-Aug-2018,02-Feb-2019,"Construction of ward office in ward no 196","o196 Anjanapura","Executive Engineer Bangalore South Division Bomanahalli Zone","P1771 Zone Works - POW Works","Sri K Uday kumar",9845183166,,"First and Final",000073,07-Aug-2018,000022,15-May-2019,000074,29-May-2019,,"           ","000135 / 04-Aug-2021 in RTGS",2613700,"Twenty Six Lakh Thirteen Thousand Seven Hundred ",328035,"Three Lakh Twenty Eight Thousand Thirty Five",2285665,"Twenty Two Lakh Eighty Five Thousand Six Hundred Sixty Five"
