"Sl No","Job Number","Start Date","End Date","Name of Work",Ward,Office,"Budget Head",Contractor,Mobile,Email,"Bill Type","Order Number","Order Date","SBR Number","SBR Date","BR Number","BR Date","CBR Number","CBR Date",Payment,Gross,"Gross In words",Deduction,"Deduction in words",Nett,"Nett in words"
329,196-16-000037,11-May-2016,20-Jun-2016,"Improvements to roads and drains at Surrounding areas of Bhaskar nagara in ward no 196","o196 Anjanapura","Executive Engineer Bangalore South Division Bomanahalli Zone","P3089 Special Development works in 7 CMC and 1 TMC area in BBMP",Rudresh.A,9880247237,,"First and Final",000024,11-May-2016,000018,20-Jun-2016,000032,27-Jun-2016,010079,02-Mar-2018,"000418 / 12-Mar-2018 in RTGS",2030142,"Twenty  Lakh Thirty  Thousand One Hundred Fourty Two",277375,"Two Lakh Seventy Seven Thousand Three Hundred Seventy Five",1752767,"Seventeen Lakh Fifty Two Thousand Seven Hundred Sixty Seven"
330,196-16-000019,05-May-2016,11-Jul-2016,"Improvements of Roads and Drains at Muneshwara nagara  in ward no 196","o196 Anjanapura","Executive Engineer Bangalore South Division Bomanahalli Zone","P3075 Special comprehensive development works in Bangalore city (Bangalore city in charge Minister Discretionary Grants)","V Venkataraju",9845183166,,"First and Final",000020,05-May-2016,000046,15-Jul-2016,000098,16-Aug-2016,002885,22-Jun-2018,"000099 / 23-Jun-2018 in RTGS",5203670,"Fifty Two Lakh Three Thousand Six Hundred Seventy ",736780,"Seven Lakh Thirty Six Thousand Seven Hundred Eighty ",4466890,"Fourty Four Lakh Sixty Six Thousand Eight Hundred Ninety "
331,196-16-000018,05-May-2016,04-Aug-2016,"Improvements of Roads and Drains at Silicon City layout in ward no 196","o196 Anjanapura","Executive Engineer Bangalore South Division Bomanahalli Zone","P3075 Special comprehensive development works in Bangalore city (Bangalore city in charge Minister Discretionary Grants)","Shankar B",9876543201,,"First and Final",000005,05-May-2016,000033,06-Jul-2016,000068,30-Jul-2016,000527,13-Apr-2018,"000023 / 24-Apr-2018 in RTGS",4819400,"Fourty Eight Lakh Nineteen Thousand Four Hundred ",669160,"Six Lakh Sixty Nine Thousand One Hundred Sixty ",4150240,"Fourty One Lakh Fifty  Thousand Two Hundred Fourty "
332,196-16-000013,05-May-2016,30-May-2016,"Improvements of Roads and Drains at Sindhi layout Main Roads in ward no 196","o196 Anjanapura","Executive Engineer Bangalore South Division Bomanahalli Zone","P3075 Special comprehensive development works in Bangalore city (Bangalore city in charge Minister Discretionary Grants)",V.Venkataraju,9900145168,,"First and Final",000006,05-May-2016,000010,30-May-2016,000021,31-May-2016,009683,08-Feb-2018,"000388 / 09-Feb-2018 in RTGS",5228660,"Fifty Two Lakh Twenty Eight Thousand Six Hundred Sixty ",731730,"Seven Lakh Thirty One Thousand Seven Hundred Thirty ",4496930,"Fourty Four Lakh Ninety Six Thousand Nine Hundred Thirty "
333,196-16-000007,05-May-2016,16-Jan-2017,"Providing UGD in Anjanapura from circle to Kembathalli Road in ward no 196","o196 Anjanapura","Executive Engineer Bangalore South Division Bomanahalli Zone","P1771 Zone Works - POW Works",venkataraju,9845183166,,"First and Final",000021,03-May-2016,000098,04-Feb-2017,000250,04-Feb-2017,001218,29-Apr-2019,"000038 / 06-May-2019 in RTGS",2064500,"Twenty  Lakh Sixty Four Thousand Five Hundred ",308730,"Three Lakh Eight Thousand Seven Hundred Thirty ",1755770,"Seventeen Lakh Fifty Five Thousand Seven Hundred Seventy "
334,196-16-000042,30-Mar-2016,30-Dec-2016,"Improvements road and drains at B D A Qtrs. Area in ward no 196","o196 Anjanapura","Executive Engineer Bangalore South Division Bomanahalli Zone","P0190 Works sanctioned by Hon Mayor",kridl,9845183166,,"First and Final",000264,30-Mar-2016,000094,30-Dec-2016,000239,02-Jan-2017,002059,20-Jul-2020,"000221 / 04-Dec-2020 in RTGS",4895000,"Fourty Eight Lakh Ninety Five Thousand ",820850,"Eight Lakh Twenty  Thousand Eight Hundred Fifty ",4074150,"Fourty  Lakh Seventy Four Thousand One Hundred Fifty "
335,196-16-000041,30-Mar-2016,30-Jun-2016,"Improvements road and drains at Avalahalli surrounding area in ward no 196","o196 Anjanapura","Executive Engineer Bangalore South Division Bomanahalli Zone","P0190 Works sanctioned by Hon Mayor","KRIDL BHUSIRI  ACCOU",0000000000,,"First and Final",000263,30-Mar-2016,000037,11-Jul-2016,000089,30-Jul-2016,,"           ","000375 / 23-Feb-2022 in RTGS",4892000,"Fourty Eight Lakh Ninety Two Thousand ",813220,"Eight Lakh Thirteen Thousand Two Hundred Twenty ",4078780,"Fourty  Lakh Seventy Eight Thousand Seven Hundred Eighty "
336,196-16-000032,28-Mar-2016,15-Jul-2016,"Providing water pipes and other water supply related works  in ward no 196","o196 Anjanapura","Executive Engineer Bangalore South Division Bomanahalli Zone","P2415 Reserve fund for TandF Committee",KRIDL,9845183166,,"First and Final",00A261,28-Mar-2016,000049,19-Jul-2016,000131,30-Aug-2016,001446,16-May-2018,"000052 / 18-May-2018 in RTGS",4904465,"Fourty Nine Lakh Four Thousand Four Hundred Sixty Five",731380,"Seven Lakh Thirty One Thousand Three Hundred Eighty ",4173085,"Fourty One Lakh Seventy Three Thousand Eighty Five"
337,196-16-000031,28-Mar-2016,12-May-2016,"Improvements of roads, drains culverts and Development works in ward no 196 Anjanapura","o196 Anjanapura","Executive Engineer Bangalore South Division Bomanahalli Zone","P2415 Reserve fund for TandF Committee",KRIDL,9845131166,,Final,000262,28-Mar-2016,000043,13-Jul-2016,000090,30-Jul-2016,000767,30-Apr-2018,"000032 / 03-May-2018 in RTGS",4999390,"Fourty Nine Lakh Ninety Nine Thousand Three Hundred Ninety ",804930,"Eight Lakh Four Thousand Nine Hundred Thirty ",4194460,"Fourty One Lakh Ninety Four Thousand Four Hundred Sixty "
338,196-16-000005,18-Feb-2016,30-Jun-2016,"Drilling of Borewells-3 Nos in ward no 196","o196 Anjanapura","Executive Engineer Bangalore South Division Bomanahalli Zone","P1771 Zone Works - POW Works","MANJUNATHA K",9485183166,,"First and Final",000229,18-Feb-2016,000047,18-Jul-2016,000104,19-Aug-2016,008574,19-Dec-2017,"000336 / 21-Dec-2017 in RTGS",2038080,"Twenty  Lakh Thirty Eight Thousand Eighty ",257950,"Two Lakh Fifty Seven Thousand Nine Hundred Fifty ",1780130,"Seventeen Lakh Eighty  Thousand One Hundred Thirty "
339,196-16-000008,18-Feb-2016,25-May-2016,"ProviProviding New UGD, Drain and Improvements to road at Avalahalli in ward no 196","o196 Anjanapura","Executive Engineer Bangalore South Division Bomanahalli Zone","P1771 Zone Works - POW Works",K.Manjunath,9632229990,,"First and Final",000230,18-Feb-2016,000016,25-May-2016,000025,31-May-2016,002923,25-Jun-2018,"000103 / 27-Jun-2018 in RTGS",2090719,"Twenty  Lakh Ninety  Thousand Seven Hundred Nineteen",287510,"Two Lakh Eighty Seven Thousand Five Hundred Ten",1803209,"Eighteen Lakh Three Thousand Two Hundred Nine"
340,196-16-000009,18-Feb-2016,31-May-2016,"Improvements of Footpaths, Culverts and drains in ward no 196","o196 Anjanapura","Executive Engineer Bangalore South Division Bomanahalli Zone","P1771 Zone Works - POW Works",K.Manjunath,9632229990,,"First and Final",000231,18-Feb-2016,000014,25-May-2016,000026,31-May-2016,000532,13-Apr-2018,"000023 / 24-Apr-2018 in RTGS",1569755,"Fifteen Lakh Sixty Nine Thousand Seven Hundred Fifty Five",222415,"Two Lakh Twenty Two Thousand Four Hundred Fifteen",1347340,"Thirteen Lakh Fourty Seven Thousand Three Hundred Fourty "
341,196-16-000004,03-Feb-2016,04-Feb-2017,"Maintenance of Borewells in ward no 196","o196 Anjanapura","Executive Engineer Bangalore South Division Bomanahalli Zone","P1771 Zone Works - POW Works","Franics A",9845131166,,"First and Final",000193,03-Feb-2016,000101,04-Feb-2017,000248,04-Feb-2017,005004,08-Aug-2018,"000170 / 14-Aug-2018 in RTGS",1997000,"Nineteen Lakh Ninety Seven Thousand ",252800,"Two Lakh Fifty Two Thousand Eight Hundred ",1744200,"Seventeen Lakh Fourty Four Thousand Two Hundred "
342,196-16-000002,03-Feb-2016,20-Jun-2016,"Filling of Pothole in ward no 196","o196 Anjanapura","Executive Engineer Bangalore South Division Bomanahalli Zone","P1771 Zone Works - POW Works","Sri Rudresh A",9880247237,,"First and Final",000191,03-Feb-2016,000025,20-Jun-2016,000042,30-Jun-2016,002186,25-May-2017,"000075 / 27-May-2017 in RTGS",1499582,"Fourteen Lakh Ninety Nine Thousand Five Hundred Eighty Two",197160,"One Lakh Ninety Seven Thousand One Hundred Sixty ",1302422,"Thirteen Lakh Two Thousand Four Hundred Twenty Two"
343,196-16-000006,03-Feb-2016,28-Mar-2016,"Improvements of road, drain and construction of culverts at Narayananagara in ward no 196","o196 Anjanapura","Executive Engineer Bangalore South Division Bomanahalli Zone","P1771 Zone Works - POW Works","Gopal G ",9900218893,,"First and Final",000180,03-Feb-2016,000038,28-Mar-2016,000246,31-Mar-2016,006689,10-Oct-2017,"000247 / 12-Oct-2017 in RTGS",2071480,"Twenty  Lakh Seventy One Thousand Four Hundred Eighty ",293210,"Two Lakh Ninety Three Thousand Two Hundred Ten",1778270,"Seventeen Lakh Seventy Eight Thousand Two Hundred Seventy "
344,196-15-000005,07-Jan-2015,25-Apr-2015,"Improvements of Roads and Drains at Thippasandra and Surrounding areas in ward no 196","o196 Anjanapura","Executive Engineer Anjanapura Division Bomanahalli Zone","P1771 Zone Works - POW Works","gopal g",9900218893,,"First and Final",000166,01-Apr-2015,000001,25-Apr-2015,000001,27-Apr-2015,000703,24-Apr-2017,"000033 / 26-Apr-2017 in RTGS",1961625,"Nineteen Lakh Sixty One Thousand Six Hundred Twenty Five",268767,"Two Lakh Sixty Eight Thousand Seven Hundred Sixty Seven",1692858,"Sixteen Lakh Ninety Two Thousand Eight Hundred Fifty Eight"
345,196-15-000022,24-Mar-2015,20-Nov-2015,"Improvements of roads drains culverts and UGD works in ward no 196 Anjanapura","o196 Anjanapura","Executive Engineer Bangalore South Division Bomanahalli Zone","P2415 Reserve fund for TandF Committee",KRIDL,1234567890,,"First and Final",000298,24-Mar-2015,000027,20-Nov-2015,000179,30-Nov-2015,004328,01-Aug-2017,"000167 / 03-Aug-2017 in RTGS",4996140,"Fourty Nine Lakh Ninety Six Thousand One Hundred Fourty ",807430,"Eight Lakh Seven Thousand Four Hundred Thirty ",4188710,"Fourty One Lakh Eighty Eight Thousand Seven Hundred Ten"
346,196-15-000008,14-Feb-2015,22-Jun-2015,"Improvement of Drains and Providing Covering slabs at Srinidhi layout to Harinagara Opposite to Masjid road in ward no 196","o196 Anjanapura","Executive Engineer Bangalore South Division Bomanahalli Zone","P1771 Zone Works - POW Works","B K Prakash",9480339113,,Final,000285,13-Feb-2015,000006,30-Jun-2015,000066,30-Jun-2015,001617,16-May-2017,"000056 / 18-May-2017 in RTGS",1921450,"Nineteen Lakh Twenty One Thousand Four Hundred Fifty ",264390,"Two Lakh Sixty Four Thousand Three Hundred Ninety ",1657060,"Sixteen Lakh Fifty Seven Thousand Sixty "
347,196-14-000062,02-Feb-2015,15-Jun-2016,"Removing of damaged drain slabs and Refixing and removing debries in ward no 196  ","o196 Anjanapura","Executive Engineer Bangalore South Division Bomanahalli Zone","P2434 Development works for Bangalore City",KRIDL,9845183166,,"First and Final",000196,02-Feb-2015,000053,19-Jul-2016,000168,14-Sep-2016,002161,04-Jun-2018,"000071 / 06-Jun-2018 in RTGS",1480540,"Fourteen Lakh Eighty  Thousand Five Hundred Fourty ",225880,"Two Lakh Twenty Five Thousand Eight Hundred Eighty ",1254660,"Twelve Lakh Fifty Four Thousand Six Hundred Sixty "
348,196-14-000056,02-Feb-2015,28-Mar-2016,"Providing water pipes and other water supply related works in ward no 196  ","o196 Anjanapura","Executive Engineer Bangalore South Division Bomanahalli Zone","P2434 Development works for Bangalore City",KRIDL,9845966999,,"First and Final",000190,02-Feb-2015,000042,28-Mar-2016,000247,31-Mar-2016,006690,10-Oct-2017,"000247 / 12-Oct-2017 in RTGS",1998703,"Nineteen Lakh Ninety Eight Thousand Seven Hundred Three",315303,"Three Lakh Fifteen Thousand Three Hundred Three",1683400,"Sixteen Lakh Eighty Three Thousand Four Hundred "
349,196-14-000060,02-Feb-2015,26-Mar-2016,"Fixing signage boards in ward no 196  ","o196 Anjanapura","Executive Engineer Bangalore South Division Bomanahalli Zone","P2434 Development works for Bangalore City",KRIDL,9845966999,,"First and Final",000189,02-Feb-2015,000041,28-Mar-2016,000243,31-Mar-2016,010933,26-Mar-2018,"000439 / 27-Mar-2018 in RTGS",995850,"Nine Lakh Ninety Five Thousand Eight Hundred Fifty ",162440,"One Lakh Sixty Two Thousand Four Hundred Fourty ",833410,"Eight Lakh Thirty Three Thousand Four Hundred Ten"
350,196-15-000003,02-Feb-2015,28-Mar-2016,"Improvements of Roads and Drains at Gollahalli and Surrounding areas in ward no 196","o196 Anjanapura","Executive Engineer Bangalore South Division Bomanahalli Zone","P1771 Zone Works - POW Works","K Uday Kumar ",9845183166,,"First and Final",000252,02-Feb-2015,000037,28-Mar-2016,000241,31-Mar-2016,006688,10-Oct-2017,"000247 / 12-Oct-2017 in RTGS",1965430,"Nineteen Lakh Sixty Five Thousand Four Hundred Thirty ",281570,"Two Lakh Eighty One Thousand Five Hundred Seventy ",1683860,"Sixteen Lakh Eighty Three Thousand Eight Hundred Sixty "
351,196-15-000016,02-Feb-2015,30-Mar-2016,"Providing pothole filling in ward no 196","o196 Anjanapura","Executive Engineer Bangalore South Division Bomanahalli Zone","P1771 Zone Works - POW Works","K Satish",9886631704,,"First and Final",000259,02-Feb-2015,000044,31-Mar-2016,000251,31-Mar-2016,004109,21-Jul-2017,"000155 / 25-Jul-2017 in RTGS",993352,"Nine Lakh Ninety Three Thousand Three Hundred Fifty Two",127866,"One Lakh Twenty Seven Thousand Eight Hundred Sixty Six",865486,"Eight Lakh Sixty Five Thousand Four Hundred Eighty Six"
352,196-15-000011,02-Feb-2015,27-Jan-2016,"Maintenance of Existing Bore-wells in ward no 196","o196 Anjanapura","Executive Engineer Bangalore South Division Bomanahalli Zone","P1771 Zone Works - POW Works","Francis A ",9448489352,,"First and Final",A00197,02-Feb-2015,000036,26-Feb-2016,000231,29-Feb-2016,001908,19-May-2017,"000064 / 20-May-2017 in RTGS",2095581,"Twenty  Lakh Ninety Five Thousand Five Hundred Eighty One",265105,"Two Lakh Sixty Five Thousand One Hundred Five",1830476,"Eighteen Lakh Thirty  Thousand Four Hundred Seventy Six"
353,196-15-000012,02-Feb-2015,26-Feb-2016,"Maintenance of ward in ward no 196","o196 Anjanapura","Executive Engineer Bangalore South Division Bomanahalli Zone","P1771 Zone Works - POW Works","K Satish",9886631704,,"First and Final",000260,02-Feb-2015,000035,26-Feb-2016,000229,29-Feb-2016,006639,16-Jan-2017,"000191 / 18-Feb-2017 in RTGS",1991882,"Nineteen Lakh Ninety One Thousand Eight Hundred Eighty Two",252066,"Two Lakh Fifty Two Thousand Sixty Six",1739816,"Seventeen Lakh Thirty Nine Thousand Eight Hundred Sixteen"
354,196-14-000061,02-Feb-2015,29-Dec-2015,"Fixing of Covering slabs and kerbs to the drains at Harinagara main road in ward no 196  ","o196 Anjanapura","Executive Engineer Bangalore South Division Bomanahalli Zone","P2434 Development works for Bangalore City",KRIDL,9900218893,,Final,000191,02-Feb-2015,000029,29-Dec-2015,000192,31-Dec-2015,004911,21-Aug-2017,"000191 / 22-Aug-2017 in RTGS",1999441,"Nineteen Lakh Ninety Nine Thousand Four Hundred Fourty One",317925,"Three Lakh Seventeen Thousand Nine Hundred Twenty Five",1681516,"Sixteen Lakh Eighty One Thousand Five Hundred Sixteen"
355,196-15-000009,02-Feb-2015,23-Feb-2015,"Clearing, Leveling and Improvements of Grave Yard of Avalahalli Surrounding area in ward no 196","o196 Anjanapura","Executive Engineer Bangalore South Division Bomanahalli Zone","P1771 Zone Works - POW Works",Narasimhaswamy,1234567890,,Final,000212,02-Feb-2015,000158,23-Feb-2015,000159,31-Oct-2015,004900,21-Aug-2017,"000191 / 22-Aug-2017 in RTGS",1796850,"Seventeen Lakh Ninety Six Thousand Eight Hundred Fifty ",230540,"Two Lakh Thirty  Thousand Five Hundred Fourty ",1566310,"Fifteen Lakh Sixty Six Thousand Three Hundred Ten"
356,196-15-000010,02-Feb-2015,23-Feb-2015,"Improvements of Grave Yard of B.D.A Quarters  in ward no 196","o196 Anjanapura","Executive Engineer Bangalore South Division Bomanahalli Zone","P1771 Zone Works - POW Works",Narasimhaswamy,1234567890,,Final,000213,02-Feb-2015,000159,23-Feb-2015,000158,31-Oct-2015,003729,10-Jul-2017,"000136 / 12-Jul-2017 in RTGS",1959859,"Nineteen Lakh Fifty Nine Thousand Eight Hundred Fifty Nine",267965,"Two Lakh Sixty Seven Thousand Nine Hundred Sixty Five",1691894,"Sixteen Lakh Ninety One Thousand Eight Hundred Ninety Four"
357,196-15-000001,02-Feb-2015,20-Feb-2015,"Improvements of Roads and Drains at Kembathalli and Surrounding areas in ward no 196","o196 Anjanapura","Executive Engineer Bangalore South Division Bomanahalli Zone","P1771 Zone Works - POW Works","FRANICS A",9900245682,,"First and Final",000199,02-Feb-2015,000153,20-Feb-2015,000102,31-Jul-2015,003356,21-Jun-2017,"000117 / 23-Jun-2017 in RTGS",2070000,"Twenty  Lakh Seventy  Thousand ",337520,"Three Lakh Thirty Seven Thousand Five Hundred Twenty ",1732480,"Seventeen Lakh Thirty Two Thousand Four Hundred Eighty "
358,196-15-000004,02-Feb-2015,20-Feb-2015,"Improvements of Roads and Drains at Avalahalli and Surrounding areas in ward no 196","o196 Anjanapura","Executive Engineer Bangalore South Division Bomanahalli Zone","P1771 Zone Works - POW Works",A.FRANICS,9900245682,,"First and Final",000198,02-Feb-2015,000154,20-Feb-2015,000103,31-Jul-2015,003358,21-Jun-2017,"000117 / 23-Jun-2017 in RTGS",2070000,"Twenty  Lakh Seventy  Thousand ",343243,"Three Lakh Fourty Three Thousand Two Hundred Fourty Three",1726757,"Seventeen Lakh Twenty Six Thousand Seven Hundred Fifty Seven"
359,196-15-000017,02-Feb-2015,20-Feb-2015,"Construction of UGD and missed links in ward no 196","o196 Anjanapura","Executive Engineer Bangalore South Division Bomanahalli Zone","P1771 Zone Works - POW Works","S R SIDDARAJU",9036441488,,"First and Final",000203,02-Feb-2015,000155,20-Feb-2015,000101,31-Jul-2015,003355,21-Jun-2017,"000117 / 23-Jun-2017 in RTGS",1040000,"Ten Lakh Fourty  Thousand ",161300,"One Lakh Sixty One Thousand Three Hundred ",878700,"Eight Lakh Seventy Eight Thousand Seven Hundred "
360,196-15-000002,02-Feb-2015,26-Jun-2015,"Improvements of Roads and Drains at Anjanapura and Surrounding areas in ward no 196","o196 Anjanapura","Executive Engineer Bangalore South Division Bomanahalli Zone","P1771 Zone Works - POW Works","H C Umesh",9141667771,,Final,000204,02-Feb-2015,000007,30-Jun-2015,000063,30-Jun-2015,001615,16-May-2017,"000056 / 18-May-2017 in RTGS",1877155,"Eighteen Lakh Seventy Seven Thousand One Hundred Fifty Five",260215,"Two Lakh Sixty  Thousand Two Hundred Fifteen",1616940,"Sixteen Lakh Sixteen Thousand Nine Hundred Fourty "
361,196-14-000058,02-Feb-2015,28-Apr-2015,"Replacement old damaged UGD pipe and Missed links in ward no 196","o196 Anjanapura","Executive Engineer Bangalore South Division Bomanahalli Zone","P2434 Development works for Bangalore City",KRIDL,9141667771,,"First and Final",000195,02-Feb-2015,000004,30-Apr-2015,000009,30-Apr-2015,000751,24-Apr-2017,"000033 / 26-Apr-2017 in RTGS",1982830,"Nineteen Lakh Eighty Two Thousand Eight Hundred Thirty ",296700,"Two Lakh Ninety Six Thousand Seven Hundred ",1686130,"Sixteen Lakh Eighty Six Thousand One Hundred Thirty "
362,196-15-000014,02-Feb-2015,28-Apr-2015,"Construction of Drains and Culverts in ward no 196","o196 Anjanapura","Executive Engineer Bangalore South Division Bomanahalli Zone","P1771 Zone Works - POW Works",UMESH,9141667771,,"First and Final",000205,02-Feb-2015,000005,30-Apr-2015,000008,30-Apr-2015,000750,24-Apr-2017,"000033 / 26-Apr-2017 in RTGS",929485,"Nine Lakh Twenty Nine Thousand Four Hundred Eighty Five",123510,"One Lakh Twenty Three Thousand Five Hundred Ten",805975,"Eight Lakh Five Thousand Nine Hundred Seventy Five"
363,196-15-000015,02-Feb-2015,23-Apr-2015,"Providing and fixing of name boards in ward no 196","o196 Anjanapura","Executive Engineer Bangalore South Division Bomanahalli Zone","P1771 Zone Works - POW Works","antony raj R",9035796609,,"First and Final",000211,02-Feb-2015,000002,30-Apr-2015,000010,30-Apr-2015,000944,25-Apr-2017,"000033 / 26-Apr-2017 in RTGS",887590,"Eight Lakh Eighty Seven Thousand Five Hundred Ninety ",118130,"One Lakh Eighteen Thousand One Hundred Thirty ",769460,"Seven Lakh Sixty Nine Thousand Four Hundred Sixty "
364,196-13-000035,18-Dec-2014,29-Jan-2015,"PROVIDING ADDITIONAL STREET LIGHTS AND CONTROL SWITCHES IN WARD NO 196","o196 Anjanapura","Executive Engineer Electrical Division Bomanahalli Zone","P1828 Provision of Additional Fittings Streetlights","M/S SREE SREEKANTESHWARA ELECTRICALS, ",9632977771,,"First and Final",000018,18-Dec-2014,000110,29-Jan-2015,000115,31-Jan-2015,001268,21-May-2016,"000038 / 28-May-2016 in RTGS",199030,"One Lakh Ninety Nine Thousand Thirty ",12205,"Twelve Thousand Two Hundred Five",186825,"One Lakh Eighty Six Thousand Eight Hundred Twenty Five"
365,196-14-000023,17-Nov-2014,27-Feb-2016,"PROVIDING DRINKING WATER SUPPLY THROUGH TANKERS AT ANJANAPURA SURROUNDING LAYOUT IN WARD NO 196","o196 Anjanapura","Executive Engineer Bangalore South Division Bomanahalli Zone","P1802 Water Supply New Areas","K Satish",9886631704,,"First and Final",000160,17-Nov-2014,000039,28-Mar-2016,000248,31-Mar-2016,007353,17-Feb-2017,"000198 / 25-Feb-2017 in RTGS",3148261,"Thirty One Lakh Fourty Eight Thousand Two Hundred Sixty One",400280,"Four Lakh Two Hundred Eighty ",2747981,"Twenty Seven Lakh Fourty Seven Thousand Nine Hundred Eighty One"
366,196-11-000060,02-Aug-2014,05-Jul-2016,"CONSTRUCTION OF SC/ST HOUSES IN  KEMMABATHALLI   A K COLONY IN WARD NO 196 ANJANAPURA ( 10 NOS )","o196 Anjanapura","Executive Engineer Bangalore South Division Bomanahalli Zone","P1878 18per - Works (Bhagyajyothi, Sooru / Neeru Yojane and General) (54 Lakhs / New Wards)","Ramkrishnappa D",9901279704,,"First and Final",000100,02-Aug-2014,000052,18-Jul-2016,000095,30-Jul-2016,004230,31-Jul-2017,"000172 / 08-Aug-2017 in RTGS",3020060,"Thirty  Lakh Twenty  Thousand Sixty ",417775,"Four Lakh Seventeen Thousand Seven Hundred Seventy Five",2602285,"Twenty Six Lakh Two Thousand Two Hundred Eighty Five"
367,196-14-000022,21-Jul-2014,28-Jan-2015,"DRILLING OF BOREWELLS AND ERECTION SUBERCIBLE PUMP IN WARD NO 196","o196 Anjanapura","Executive Engineer Bangalore South Division Bomanahalli Zone","P1802 Water Supply New Areas","Francis A ",9036718749,,"First and Final",000097,21-Jul-2014,000148,31-Jan-2015,000495,31-Jan-2015,003707,09-Oct-2015,"001238 / 16-Nov-2015 in RTGS",2006858,"Twenty  Lakh Six Thousand Eight Hundred Fifty Eight",259302,"Two Lakh Fifty Nine Thousand Three Hundred Two",1747556,"Seventeen Lakh Fourty Seven Thousand Five Hundred Fifty Six"
368,196-13-000012,03-Jul-2013,21-Aug-2014,"Improvements of Roads and Drains at Sun Marc School Surrounding in ward no 196","o196 Anjanapura","Executive Engineer Bangalore South Division Bomanahalli Zone","P1771 Zone Works - POW Works","H B Rajendra",9845131166,,"First and Final",000079,03-Jul-2014,000089,30-Aug-2014,000279,30-Aug-2014,004397,06-Aug-2016,"000096 / 09-Aug-2016 in RTGS",1562976,"Fifteen Lakh Sixty Two Thousand Nine Hundred Seventy Six",223393,"Two Lakh Twenty Three Thousand Three Hundred Ninety Three",1339583,"Thirteen Lakh Thirty Nine Thousand Five Hundred Eighty Three"
369,196-12-000068,22-Jul-2014,21-Oct-2014,"Remodeling of Storm Water Drain BH812 at Harinagar in Anjanapura Ward No.196 in Bommanahalli zone.","o196 Anjanapura","Chief Engineer SWD Central Zone","P2352 Remodelling of Kormangala Valley (Non Jnnurm Works",K.N.Somashekar,9343330888,,Final,000001,26-Jun-2014,000013,28-Feb-2015,000266,28-Feb-2015,000900,04-Jul-2015,"000122 / 07-Jul-2015 in RTGS",851850,"Eight Lakh Fifty One Thousand Eight Hundred Fifty ",53200,"Fifty Three Thousand Two Hundred ",798650,"Seven Lakh Ninety Eight Thousand Six Hundred Fifty "
370,196-12-000068,22-Jul-2014,21-Oct-2014,"Remodeling of Storm Water Drain BH812 at Harinagar in Anjanapura Ward No.196 in Bommanahalli zone.","o196 Anjanapura","Chief Engineer SWD Central Zone","P2352 Remodelling of Kormangala Valley (Non Jnnurm Works",K.N.Somashekar,9343330888,,Running,000001,26-Jun-2014,000008,30-Dec-2014,000221,31-Dec-2014,001014,08-Jul-2015,"000164 / 13-Jul-2015 in RTGS",656900,"Six Lakh Fifty Six Thousand Nine Hundred ",0,,656900,"Six Lakh Fifty Six Thousand Nine Hundred "
371,196-14-000007,22-May-2014,16-Jan-2015,"Improvement of Cross Roads and Drains at Narayan nagara layout  in ward no 196","o196 Anjanapura","Executive Engineer Bangalore South Division Bomanahalli Zone","P1771 Zone Works - POW Works","Satish K ",9886631704,,"First and Final",000024,22-May-2014,000146,16-Jan-2015,000498,31-Jan-2015,007396,20-Feb-2017,"000195 / 22-Feb-2017 in RTGS",1761227,"Seventeen Lakh Sixty One Thousand Two Hundred Twenty Seven",251955,"Two Lakh Fifty One Thousand Nine Hundred Fifty Five",1509272,"Fifteen Lakh Nine Thousand Two Hundred Seventy Two"
372,196-14-000021,04-Mar-2014,24-Nov-2014,"Manitenance of ward in ward no 196","o196 Anjanapura","Executive Engineer Bangalore South Division Bomanahalli Zone","P1771 Zone Works - POW Works","Satish K ",9886631704,,"First and Final",000571,04-Mar-2014,000123,29-Nov-2014,000419,29-Nov-2014,006301,03-Jan-2017,"000164 / 05-Jan-2017 in RTGS",981921,"Nine Lakh Eighty One Thousand Nine Hundred Twenty One",114582,"One Lakh Fourteen Thousand Five Hundred Eighty Two",867339,"Eight Lakh Sixty Seven Thousand Three Hundred Thirty Nine"
373,196-14-000048,04-Mar-2014,26-May-2014,"Fixing of Electrical fixtures and installation in ward no 194 ,195 and 196 of Anjanapura sub division","o196 Anjanapura","Executive Engineer Electrical Division Bomanahalli Zone","P2434 Development works for Bangalore City","TECHNICAL MANAGER-01 KRIDL",9945510720,,"Second and Final",000067,04-Mar-2014,000024,26-May-2014,000024,27-May-2014,001238,20-May-2016,"000038 / 28-May-2016 in RTGS",3306596,"Thirty Three Lakh Six Thousand Five Hundred Ninety Six",492690,"Four Lakh Ninety Two Thousand Six Hundred Ninety ",2813906,"Twenty Eight Lakh Thirteen Thousand Nine Hundred Six"
