"Sl No","Job Number","Start Date","End Date","Name of Work",Ward,Office,"Budget Head",Contractor,Mobile,Email,"Bill Type","Order Number","Order Date","SBR Number","SBR Date","BR Number","BR Date","CBR Number","CBR Date",Payment,Gross,"Gross In words",Deduction,"Deduction in words",Nett,"Nett in words"
1,196-17-000085,31-Mar-2017,15-Apr-2019,"Improvements to roads and drains in Gollahalli at ward no 196 Anjanapura","o196 Anjanapura","Executive Engineer Bangalore South Division Bomanahalli Zone","P2415 Reserve fund for TandF Committee","KRIDL BHUSIRI  ACCOU",0000000000,,"First and Final",000059,16-Jun-2022,000024,06-Aug-2022,000062,10-Aug-2022,,"           ","Under Process in EE (Acts. Supdt.)",4993590,"Fourty Nine Lakh Ninety Three Thousand Five Hundred Ninety ",490628,"Four Lakh Ninety  Thousand Six Hundred Twenty Eight",4502962,"Fourty Five Lakh Two Thousand Nine Hundred Sixty Two"
2,196-22-000006,01-Apr-2022,02-Feb-2023,"Annual Operation and Maintenance of street lighting system in ward no-196,  Package B15 of Bommanahalli zone.","o196 Anjanapura","Executive Engineer Electrical Division Bomanahalli Zone","P0300 M and R to Street Lights - Replacement of Burnt Bulbs etc. (Package)","006882 SREENAG ELECTRICALS ",9980192105,,Running,000012,13-Apr-2022,000192,23-Feb-2023,000195,27-Feb-2023,,"           ","Under Process in Addl. Commr. Finance",238305,"Two Lakh Thirty Eight Thousand Three Hundred Five",16448,"Sixteen Thousand Four Hundred Fourty Eight",221857,"Two Lakh Twenty One Thousand Eight Hundred Fifty Seven"
3,196-22-000006,01-Apr-2022,02-Jan-2023,"Annual Operation and Maintenance of street lighting system in ward no-196,  Package B15 of Bommanahalli zone.","o196 Anjanapura","Executive Engineer Electrical Division Bomanahalli Zone","P0300 M and R to Street Lights - Replacement of Burnt Bulbs etc. (Package)","006882 SREENAG ELECTRICALS ",9980192105,,Running,000012,13-Apr-2022,000165,12-Jan-2023,000168,20-Jan-2023,,"           ","Under Process in Addl. Commr. Finance",238304,"Two Lakh Thirty Eight Thousand Three Hundred Four",15848,"Fifteen Thousand Eight Hundred Fourty Eight",222456,"Two Lakh Twenty Two Thousand Four Hundred Fifty Six"
4,196-22-000006,01-Apr-2022,05-Dec-2022,"Annual Operation and Maintenance of street lighting system in ward no-196,  Package B15 of Bommanahalli zone.","o196 Anjanapura","Executive Engineer Electrical Division Bomanahalli Zone","P0300 M and R to Street Lights - Replacement of Burnt Bulbs etc. (Package)","006882 SREENAG ELECTRICALS ",9980192105,,Running,000012,13-Apr-2022,000139,23-Dec-2022,000145,30-Dec-2022,,"           ","Under Process in Addl. Commr. Finance",238305,"Two Lakh Thirty Eight Thousand Three Hundred Five",16048,"Sixteen Thousand Fourty Eight",222257,"Two Lakh Twenty Two Thousand Two Hundred Fifty Seven"
5,196-22-000006,01-Apr-2022,03-Nov-2022,"Annual Operation and Maintenance of street lighting system in ward no-196,  Package B15 of Bommanahalli zone.","o196 Anjanapura","Executive Engineer Electrical Division Bomanahalli Zone","P0300 M and R to Street Lights - Replacement of Burnt Bulbs etc. (Package)","006882 SREENAG ELECTRICALS ",9980192105,,Running,000012,13-Apr-2022,000124,02-Dec-2022,000126,02-Dec-2022,,"           ","Under Process in Addl. Commr. Finance",714914,"Seven Lakh Fourteen Thousand Nine Hundred Fourteen",48792,"Fourty Eight Thousand Seven Hundred Ninety Two",666122,"Six Lakh Sixty Six Thousand One Hundred Twenty Two"
6,196-22-000006,01-Apr-2022,04-Aug-2022,"Annual Operation and Maintenance of street lighting system in ward no-196,  Package B15 of Bommanahalli zone.","o196 Anjanapura","Executive Engineer Electrical Division Bomanahalli Zone","P0300 M and R to Street Lights - Replacement of Burnt Bulbs etc. (Package)","006882 SREENAG ELECTRICALS ",9980192105,,Running,000012,13-Apr-2022,000029,17-Aug-2022,000021,17-Aug-2022,,"           ","000079 / 10-Oct-2022 in RTGS",476610,"Four Lakh Seventy Six Thousand Six Hundred Ten",31794,"Thirty One Thousand Seven Hundred Ninety Four",444816,"Four Lakh Fourty Four Thousand Eight Hundred Sixteen"
7,196-22-000006,01-Apr-2022,17-Jun-2022,"Annual Operation and Maintenance of street lighting system in ward no-196,  Package B15 of Bommanahalli zone.","o196 Anjanapura","Executive Engineer Electrical Division Bomanahalli Zone","P0300 M and R to Street Lights - Replacement of Burnt Bulbs etc. (Package)","006882 SREENAG ELECTRICALS ",9980192105,,Running,000012,13-Apr-2022,000025,16-Aug-2022,000020,17-Aug-2022,,"           ","000080 / 10-Oct-2022 in RTGS",476609,"Four Lakh Seventy Six Thousand Six Hundred Nine",32394,"Thirty Two Thousand Three Hundred Ninety Four",444215,"Four Lakh Fourty Four Thousand Two Hundred Fifteen"
8,196-21-000012,06-Apr-2022,24-Jun-2022,"Improvements of roads and drains at Muneshwara nagara SC-ST area in ward no 196","o196 Anjanapura","Executive Engineer Bangalore South Division Bomanahalli Zone","P1878 18per - Works (Bhagyajyothi, Sooru / Neeru Yojane and General) (54 Lakhs / New Wards)","SRI RAGHAVENDRA CIVI",9845183166,,"First and Final",000014,06-Apr-2022,000034,17-Oct-2022,000109,05-Dec-2022,,"           ","Under Process in Addl. Commr. Finance",10396200,"One Crore Three Lakh Ninety Six Thousand Two Hundred ",582946,"Five Lakh Eighty Two Thousand Nine Hundred Fourty Six",9813254,"Ninety Eight Lakh Thirteen Thousand Two Hundred Fifty Four"
9,196-20-000100,16-Oct-2021,24-Feb-2022,"Improvements to roads and drains from Kembathalli Near Govt School at Anjanapura ward no 196","o196 Anjanapura","Executive Engineer Bangalore South Division Bomanahalli Zone","P3726 Zonal Public Works - POW Works -60per for  Annual Maintenance and Re-asphalting of roads in Ward jurisdiction -Escrow Account - Old Ward Rs.1.20 Cr per ward and Rs.1.80 Cr for new wards","SRI RAGHAVENDRA CIVI",9845183166,,"First and Final",000077,16-Oct-2021,000006,07-May-2022,000015,09-May-2022,,"           ","Under Process in Addl. Commr. Finance",6284900,"Sixty Two Lakh Eighty Four Thousand Nine Hundred ",434300,"Four Lakh Thirty Four Thousand Three Hundred ",5850600,"Fifty Eight Lakh Fifty  Thousand Six Hundred "
10,196-20-000099,16-Oct-2021,24-Jan-2022,"Improvements to roads and drains at Silicon city layout in ward no 196","o196 Anjanapura","Executive Engineer Bangalore South Division Bomanahalli Zone","P3726 Zonal Public Works - POW Works -60per for  Annual Maintenance and Re-asphalting of roads in Ward jurisdiction -Escrow Account - Old Ward Rs.1.20 Cr per ward and Rs.1.80 Cr for new wards","SRI RAGHAVENDRA CIVI",9845183166,,"First and Final",000079,16-Oct-2021,000003,30-Apr-2022,000013,30-Apr-2022,,"           ","Under Process in Addl. Commr. Finance",6263000,"Sixty Two Lakh Sixty Three Thousand ",406300,"Four Lakh Six Thousand Three Hundred ",5856700,"Fifty Eight Lakh Fifty Six Thousand Seven Hundred "
11,196-20-000101,16-Oct-2021,24-Jan-2022,"Improvements to roads and drains at Harinagara Vinayaka Theather ward no 196","o196 Anjanapura","Executive Engineer Bangalore South Division Bomanahalli Zone","P3726 Zonal Public Works - POW Works -60per for  Annual Maintenance and Re-asphalting of roads in Ward jurisdiction -Escrow Account - Old Ward Rs.1.20 Cr per ward and Rs.1.80 Cr for new wards","SRI RAGHAVENDRA CIVI",9845183166,,"First and Final",000078,16-Oct-2021,000004,30-Apr-2022,000012,30-Apr-2022,,"           ","Under Process in Addl. Commr. Finance",6260800,"Sixty Two Lakh Sixty  Thousand Eight Hundred ",441196,"Four Lakh Fourty One Thousand One Hundred Ninety Six",5819604,"Fifty Eight Lakh Nineteen Thousand Six Hundred Four"
12,196-20-000104,14-Jul-2021,11-Oct-2021,"Improvement roads of drains at royal and surrounding area in ward no 196","o196 Anjanapura","Executive Engineer Bangalore South Division Bomanahalli Zone","P3593 Special Development works at ward Nos.18, 22, 31, 32, 44, 67, 69, 70, 74, 102, 121, 135, 139, 176, 18, 22, 31, 32, 44, 67, 69, 70, 74, 102, 121, 135, 139, 176",KRISHNAMURTHYN,9620030344,,"First and Final",000059,13-Jul-2021,000120,16-Mar-2022,000290,16-Mar-2022,,"           ","Under Process in Addl. Commr. Finance",10336100,"One Crore Three Lakh Thirty Six Thousand One Hundred ",918544,"Nine Lakh Eighteen Thousand Five Hundred Fourty Four",9417556,"Ninety Four Lakh Seventeen Thousand Five Hundred Fifty Six"
13,196-19-000063,14-Jul-2021,23-Nov-2021,"Providing Pot hole filling ward in ward no 196 Anjanapura","o196 Anjanapura","Executive Engineer Bangalore South Division Bomanahalli Zone","P3443 Developmental works at ward No.01,09,13,19,20,27,34,38,45,52,65,84,89,101,104,115,126,128,132,154,155,158.163,169,175, 181,184,185, 194,195, 196 Rs.02.00 Cr Each"," SRINIVAS ENTERPRISE",8197426655,,"First and Final",000058,13-Jul-2021,000112,23-Feb-2022,000275,24-Feb-2022,,"           ","Under Process in Addl. Commr. Finance",3133200,"Thirty One Lakh Thirty Three Thousand Two Hundred ",199770,"One Lakh Ninety Nine Thousand Seven Hundred Seventy ",2933430,"Twenty Nine Lakh Thirty Three Thousand Four Hundred Thirty "
14,196-21-000011,09-Jul-2021,24-Nov-2021,"Construction of Multi Purpose Building in ward no 196","o196 Anjanapura","Executive Engineer Bangalore South Division Bomanahalli Zone","P3864 Infrastructural and individual programmes for Special disabled","Mr  PRAKASH REDDY R",9845794311,,"First and Final",000057,08-Jul-2021,000104,29-Jan-2022,000260,03-Feb-2022,,"           ","Under Process in Addl. Commr. Finance",6816200,"Sixty Eight Lakh Sixteen Thousand Two Hundred ",317478,"Three Lakh Seventeen Thousand Four Hundred Seventy Eight",6498722,"Sixty Four Lakh Ninety Eight Thousand Seven Hundred Twenty Two"
15,196-20-000021,14-Jun-2021,25-Apr-2022,"Developmental works in Avalahalli and Anjanapura Burial ground in ward No.196","o196 Anjanapura","Executive Engineer Bangalore South Division Bomanahalli Zone","P0486 MandR to Burial Grounds and Burning ghats / Electrical creamtoruim","RAJU K J",9482435991,,"First and Final",000041,14-Jun-2021,000007,09-May-2022,000016,10-May-2022,,"           ","Under Process in Addl. Commr. Finance",20485190,"Two Crore Four Lakh Eighty Five Thousand One Hundred Ninety ",1164866,"Eleven Lakh Sixty Four Thousand Eight Hundred Sixty Six",19320324,"One Crore Ninety Three Lakh Twenty  Thousand Three Hundred Twenty Four"
16,196-20-000114,12-May-2021,25-Jun-2021,"Providing Borewells at SC/ST areas  in Ward No. 196","o196 Anjanapura","Executive Engineer Bangalore South Division Bomanahalli Zone","P1878 18per - Works (Bhagyajyothi, Sooru / Neeru Yojane and General) (54 Lakhs / New Wards)","G GOPALA",9900218893,,"First and Final",000009,11-May-2021,000046,29-Jul-2021,000141,30-Jul-2021,,"           ","000175 / 09-Jan-2023 in RTGS",5083500,"Fifty  Lakh Eighty Three Thousand Five Hundred ",226136,"Two Lakh Twenty Six Thousand One Hundred Thirty Six",4857364,"Fourty Eight Lakh Fifty Seven Thousand Three Hundred Sixty Four"
17,196-20-000113,25-Feb-2021,31-May-2021,"Improvements to roads and drains at Thippasandra surrounding area in Ward No. 196","o196 Anjanapura","Executive Engineer Bangalore South Division Bomanahalli Zone","P1878 18per - Works (Bhagyajyothi, Sooru / Neeru Yojane and General) (54 Lakhs / New Wards)","GIRISH J",9036405669,,"First and Final",000365,25-Feb-2021,000039,01-Jul-2021,000109,02-Jul-2021,,"           ","000104 / 03-Nov-2022 in RTGS",9851000,"Ninety Eight Lakh Fifty One Thousand ",823490,"Eight Lakh Twenty Three Thousand Four Hundred Ninety ",9027510,"Ninety  Lakh Twenty Seven Thousand Five Hundred Ten"
18,196-20-000073,22-Feb-2021,27-Dec-2021,"Improvements to roads and drains at  Narayananagara Surrounding area  in ward no 196","o196 Anjanapura","Executive Engineer Bangalore South Division Bomanahalli Zone","P3591 Special Developmental works at ward no. 18,82,94,116,134,189,128,196,181,96 (Each Ward 10 Cr)","SRI RAGHAVENDRA CIVI",9845183166,,"First and Final",000356,22-Feb-2021,000105,31-Jan-2022,000259,01-Feb-2022,,"           ","Under Process in Addl. Commr. Finance",10204100,"One Crore Two Lakh Four Thousand One Hundred ",1220311,"Twelve Lakh Twenty  Thousand Three Hundred Eleven",8983789,"Eighty Nine Lakh Eighty Three Thousand Seven Hundred Eighty Nine"
19,196-20-000105,23-Feb-2021,20-May-2021,"Improvement roads of drains at royal Park west side in ward no 196","o196 Anjanapura","Executive Engineer Bangalore South Division Bomanahalli Zone","P3593 Special Development works at ward Nos.18, 22, 31, 32, 44, 67, 69, 70, 74, 102, 121, 135, 139, 176, 18, 22, 31, 32, 44, 67, 69, 70, 74, 102, 121, 135, 139, 176","SRI RAGHAVENDRA CIVI",9845183166,,"First and Final",000350,22-Feb-2021,000052,30-Jul-2021,000153,31-Jul-2021,,"           ","Under Process in Addl. Commr. Finance",10383600,"One Crore Three Lakh Eighty Three Thousand Six Hundred ",1026840,"Ten Lakh Twenty Six Thousand Eight Hundred Fourty ",9356760,"Ninety Three Lakh Fifty Six Thousand Seven Hundred Sixty "
20,196-20-000107,23-Feb-2021,22-May-2021,"Improvement roads of drains Narayananagara 1st cross 2nd cross 3rd cross and surrounding area  in ward no 196","o196 Anjanapura","Executive Engineer Bangalore South Division Bomanahalli Zone","P3593 Special Development works at ward Nos.18, 22, 31, 32, 44, 67, 69, 70, 74, 102, 121, 135, 139, 176, 18, 22, 31, 32, 44, 67, 69, 70, 74, 102, 121, 135, 139, 176","SRI RAGHAVENDRA CIVI",9845183166,,"First and Final",000361,22-Feb-2021,000050,30-Jul-2021,000151,31-Jul-2021,,"           ","Under Process in Addl. Commr. Finance",10354500,"One Crore Three Lakh Fifty Four Thousand Five Hundred ",1023627,"Ten Lakh Twenty Three Thousand Six Hundred Twenty Seven",9330873,"Ninety Three Lakh Thirty  Thousand Eight Hundred Seventy Three"
21,196-20-000108,22-Feb-2021,18-May-2021,"Improvement roads of drains  10th cross 8th cross 9th cross  in ward no 196","o196 Anjanapura","Executive Engineer Bangalore South Division Bomanahalli Zone","P3593 Special Development works at ward Nos.18, 22, 31, 32, 44, 67, 69, 70, 74, 102, 121, 135, 139, 176, 18, 22, 31, 32, 44, 67, 69, 70, 74, 102, 121, 135, 139, 176","SRI RAGHAVENDRA CIVI",9845183166,,"First and Final",000362,22-Feb-2021,000055,30-Jul-2021,000154,31-Jul-2021,,"           ","Under Process in Addl. Commr. Finance",10206700,"One Crore Two Lakh Six Thousand Seven Hundred ",1009042,"Ten Lakh Nine Thousand Fourty Two",9197658,"Ninety One Lakh Ninety Seven Thousand Six Hundred Fifty Eight"
22,196-20-000109,22-Feb-2021,20-May-2021,"Improvement roads of drains  Narayana Nagara 5th main road 6th main road and 7th main road and surrounding area   in ward no 196","o196 Anjanapura","Executive Engineer Bangalore South Division Bomanahalli Zone","P3593 Special Development works at ward Nos.18, 22, 31, 32, 44, 67, 69, 70, 74, 102, 121, 135, 139, 176, 18, 22, 31, 32, 44, 67, 69, 70, 74, 102, 121, 135, 139, 176","SRI RAGHAVENDRA CIVI",9845183166,,"First and Final",000363,22-Feb-2021,000051,30-Jul-2021,000150,31-Jul-2021,,"           ","Under Process in Addl. Commr. Finance",10349300,"One Crore Three Lakh Fourty Nine Thousand Three Hundred ",1023108,"Ten Lakh Twenty Three Thousand One Hundred Eight",9326192,"Ninety Three Lakh Twenty Six Thousand One Hundred Ninety Two"
23,196-20-000110,23-Feb-2021,19-May-2021,"Improvement roads of drains at Kembathahalli main road to maramma temple road    in ward no 196","o196 Anjanapura","Executive Engineer Bangalore South Division Bomanahalli Zone","P3593 Special Development works at ward Nos.18, 22, 31, 32, 44, 67, 69, 70, 74, 102, 121, 135, 139, 176, 18, 22, 31, 32, 44, 67, 69, 70, 74, 102, 121, 135, 139, 176","SRI RAGHAVENDRA CIVI",9845183166,,"First and Final",000364,22-Feb-2021,000053,30-Jul-2021,000145,31-Jul-2021,,"           ","Under Process in Addl. Commr. Finance",10343700,"One Crore Three Lakh Fourty Three Thousand Seven Hundred ",1022573,"Ten Lakh Twenty Two Thousand Five Hundred Seventy Three",9321127,"Ninety Three Lakh Twenty One Thousand One Hundred Twenty Seven"
24,196-20-000070,23-Feb-2021,15-Jun-2021,"Improvements to roads and drains at Avalahalli  Surrounding area in ward no 196","o196 Anjanapura","Executive Engineer Bangalore South Division Bomanahalli Zone","P3591 Special Developmental works at ward no. 18,82,94,116,134,189,128,196,181,96 (Each Ward 10 Cr)","SRI RAGHAVENDRA CIVI",9845183166,,"First and Final",000351,22-Feb-2021,000037,30-Jun-2021,000107,30-Jun-2021,,"           ","Under Process in Addl. Commr. Finance",10396000,"One Crore Three Lakh Ninety Six Thousand ",1026492,"Ten Lakh Twenty Six Thousand Four Hundred Ninety Two",9369508,"Ninety Three Lakh Sixty Nine Thousand Five Hundred Eight"
25,196-21-000008,23-Feb-2021,25-May-2021,"Improvements to roads and drains at Anjanapura in ward no 196","o196 Anjanapura","Executive Engineer Bangalore South Division Bomanahalli Zone","P3798 P3798","SRI RAGHAVENDRA CIVI",9845183166,,"First and Final",000354,22-Feb-2021,000038,30-Jun-2021,000108,30-Jun-2021,,"           ","Under Process in Addl. Commr. Finance",10347350,"One Crore Three Lakh Fourty Seven Thousand Three Hundred Fifty ",901034,"Nine Lakh One Thousand Thirty Four",9446316,"Ninety Four Lakh Fourty Six Thousand Three Hundred Sixteen"
26,196-20-000092,23-Feb-2021,25-May-2021,"Improvements to road and drain Muneshwara Temple road in Yelethotana Palya at Anjanapura 9th Block in ward no 196","o196 Anjanapura","Executive Engineer Bangalore South Division Bomanahalli Zone","P2415 Reserve fund for TandF Committee","SRI RAGHAVENDRA CIVI",9845183166,,"First and Final",000357,22-Feb-2021,000030,09-Jun-2021,000074,10-Jun-2021,,"           ","Under Process in Addl. Commr. Finance",10354900,"One Crore Three Lakh Fifty Four Thousand Nine Hundred ",1023730,"Ten Lakh Twenty Three Thousand Seven Hundred Thirty ",9331170,"Ninety Three Lakh Thirty One Thousand One Hundred Seventy "
27,196-20-000094,23-Feb-2021,25-May-2021,"Improvements to roads and drain Yelethotana Palya main road in sindhu Bekary  at Anjanapura 9th Block in ward no 196","o196 Anjanapura","Executive Engineer Bangalore South Division Bomanahalli Zone","P2415 Reserve fund for TandF Committee","SRI RAGHAVENDRA CIVI",9845183166,,"First and Final",000359,22-Feb-2021,000026,05-Jun-2021,000070,05-Jun-2021,,"           ","Under Process in Addl. Commr. Finance",10319200,"One Crore Three Lakh Nineteen Thousand Two Hundred ",1020202,"Ten Lakh Twenty  Thousand Two Hundred Two",9298998,"Ninety Two Lakh Ninety Eight Thousand Nine Hundred Ninety Eight"
28,196-20-000106,23-Feb-2021,12-Apr-2021,"Improvement roads of drains at  Ashraya colony main road and cross roads  in ward no 196","o196 Anjanapura","Executive Engineer Bangalore South Division Bomanahalli Zone","P3593 Special Development works at ward Nos.18, 22, 31, 32, 44, 67, 69, 70, 74, 102, 121, 135, 139, 176, 18, 22, 31, 32, 44, 67, 69, 70, 74, 102, 121, 135, 139, 176","SRI RAGHAVENDRA CIVI",9845183166,,"First and Final",000360,22-Feb-2021,000014,07-May-2021,000048,10-May-2021,,"           ","Under Process in Addl. Commr. Finance",10327640,"One Crore Three Lakh Twenty Seven Thousand Six Hundred Fourty ",1005252,"Ten Lakh Five Thousand Two Hundred Fifty Two",9322388,"Ninety Three Lakh Twenty Two Thousand Three Hundred Eighty Eight"
29,196-20-000093,23-Feb-2021,05-Apr-2021,"Improvements to roads and drain Kempegowda road in Yelethotana  Palya at Anjanapura 9th Block in ward no 196","o196 Anjanapura","Executive Engineer Bangalore South Division Bomanahalli Zone","P2415 Reserve fund for TandF Committee","SRI RAGHAVENDRA CIVI",9845183166,,"First and Final",000358,22-Feb-2021,000011,07-May-2021,000045,07-May-2021,,"           ","Under Process in Addl. Commr. Finance",10342990,"One Crore Three Lakh Fourty Two Thousand Nine Hundred Ninety ",1022486,"Ten Lakh Twenty Two Thousand Four Hundred Eighty Six",9320504,"Ninety Three Lakh Twenty  Thousand Five Hundred Four"
30,196-20-000040,01-Feb-2021,05-May-2022,"Annual Operation and Maintenance of street lighting system in ward no-196  Package B15 of Bommanahalli zone","o196 Anjanapura","Executive Engineer Electrical Division Bomanahalli Zone","P0300 M and R to Street Lights - Replacement of Burnt Bulbs etc. (Package)","SREE SRIKANTESWARA E",9632977771,,"First and Final",000029,01-Feb-2021,000015,27-Jul-2022,000008,29-Jul-2022,,"           ","000064 / 10-Oct-2022 in RTGS",311794,"Three Lakh Eleven Thousand Seven Hundred Ninety Four",22045,"Twenty Two Thousand Fourty Five",289749,"Two Lakh Eighty Nine Thousand Seven Hundred Fourty Nine"
31,196-20-000040,01-Feb-2021,04-Apr-2022,"Annual Operation and Maintenance of street lighting system in ward no-196  Package B15 of Bommanahalli zone","o196 Anjanapura","Executive Engineer Electrical Division Bomanahalli Zone","P0300 M and R to Street Lights - Replacement of Burnt Bulbs etc. (Package)","SREE SRIKANTESWARA E",9632977771,,Running,000029,01-Feb-2021,000014,27-Jul-2022,000009,29-Jul-2022,,"           ","000065 / 10-Oct-2022 in RTGS",1247174,"Twelve Lakh Fourty Seven Thousand One Hundred Seventy Four",89978,"Eighty Nine Thousand Nine Hundred Seventy Eight",1157196,"Eleven Lakh Fifty Seven Thousand One Hundred Ninety Six"
32,196-20-000040,01-Feb-2021,31-May-2021,"Annual Operation and Maintenance of street lighting system in ward no-196  Package B15 of Bommanahalli zone","o196 Anjanapura","Executive Engineer Electrical Division Bomanahalli Zone","P0300 M and R to Street Lights - Replacement of Burnt Bulbs etc. (Package)","SREE SRIKANTESWARA E",9632977771,,Running,000029,01-Feb-2021,000015,30-Jun-2021,000015,30-Jun-2021,,"           ","000246 / 13-Oct-2021 in RTGS",623587,"Six Lakh Twenty Three Thousand Five Hundred Eighty Seven",43789,"Fourty Three Thousand Seven Hundred Eighty Nine",579798,"Five Lakh Seventy Nine Thousand Seven Hundred Ninety Eight"
33,196-20-000098,30-Dec-2020,10-May-2021,"Providing and Fixing of Name Boards in ward no 196","o196 Anjanapura","Executive Engineer Bangalore South Division Bomanahalli Zone","P1771 Zone Works - POW Works","L R INFRASTRUCTURES",7892418366,,"First and Final",000305,29-Dec-2020,000075,21-Sep-2021,000186,22-Sep-2021,,"           ","Under Process in Addl. Commr. Finance",2904000,"Twenty Nine Lakh Four Thousand ",235268,"Two Lakh Thirty Five Thousand Two Hundred Sixty Eight",2668732,"Twenty Six Lakh Sixty Eight Thousand Seven Hundred Thirty Two"
34,196-20-000041,10-Dec-2020,10-Nov-2021,"Drilling of New Borewells and Errection  2 Pumpset at Anjanapura ward no 196 Anjanapura","o196 Anjanapura","Executive Engineer Bangalore South Division Bomanahalli Zone","P3739 Special development works in Ward No. 01, 03, 04, 05, 09, 10, 13, 15, 17, 19, 20, 26, 27, 28, 29, 34, 35, 36, 39, 43, 45, 46, 51, 52, 57, 64, 65, 71, 79, 83, 85, 88, 89,93, 96, 100, 101, 103,104, 105, 108, 109, 111, 114, 115, 119, 123, 124, 125, 126, 127, 128, 129, 130, 132, 133, 137, 138, 142, 143, 146, 149, 150, 154, 155, 156, 158, 159, 160, 161, 162, 163, 164, 165, 166, 167, 168, 170, 173, 174, 175, 177, 178, 179, 181, 182, 183, 184, 185, 186, 187, 188, 189, 191, 193, 194, 195, 196  ( Total 98 wards 2.50 crors for each ward)","SRI RAGHAVENDRA CIVI",9845183166,,"First and Final",000287,09-Dec-2020,000099,23-Dec-2021,000243,24-Dec-2021,,"           ","Under Process in Addl. Commr. Finance",10351000,"One Crore Three Lakh Fifty One Thousand ",883640,"Eight Lakh Eighty Three Thousand Six Hundred Fourty ",9467360,"Ninety Four Lakh Sixty Seven Thousand Three Hundred Sixty "
35,196-20-000022,10-Dec-2020,07-Jun-2021,"Developmental works in Gollahalli and Kembathalli Bural ground in ward No.196","o196 Anjanapura","Executive Engineer Bangalore South Division Bomanahalli Zone","P0486 MandR to Burial Grounds and Burning ghats / Electrical creamtoruim","SRI RAGHAVENDRA CIVI",9845183166,,"First and Final",000286,09-Dec-2020,000059,06-Aug-2021,000160,10-Aug-2021,,"           ","Under Process in Addl. Commr. Finance",9684500,"Ninety Six Lakh Eighty Four Thousand Five Hundred ",922403,"Nine Lakh Twenty Two Thousand Four Hundred Three",8762097,"Eighty Seven Lakh Sixty Two Thousand Ninety Seven"
36,196-20-000074,18-Nov-2020,05-Apr-2021,"Improvements to roads and drains at  Avalahalli Gurukul School road  in ward no 196","o196 Anjanapura","Executive Engineer Bangalore South Division Bomanahalli Zone","P3591 Special Developmental works at ward no. 18,82,94,116,134,189,128,196,181,96 (Each Ward 10 Cr)","G GOPALA",9900218893,,"First and Final",000237,17-Nov-2020,000010,06-May-2021,000044,07-May-2021,,"           ","Under Process in Addl. Commr. Finance",10353075,"One Crore Three Lakh Fifty Three Thousand Seventy Five",874785,"Eight Lakh Seventy Four Thousand Seven Hundred Eighty Five",9478290,"Ninety Four Lakh Seventy Eight Thousand Two Hundred Ninety "
37,196-20-000042,11-Nov-2020,21-Jun-2021,"Improvements to roads and drains at Hemanna layout in  ward no 196 Anjanapura","o196 Anjanapura","Executive Engineer Bangalore South Division Bomanahalli Zone","P3739 Special development works in Ward No. 01, 03, 04, 05, 09, 10, 13, 15, 17, 19, 20, 26, 27, 28, 29, 34, 35, 36, 39, 43, 45, 46, 51, 52, 57, 64, 65, 71, 79, 83, 85, 88, 89,93, 96, 100, 101, 103,104, 105, 108, 109, 111, 114, 115, 119, 123, 124, 125, 126, 127, 128, 129, 130, 132, 133, 137, 138, 142, 143, 146, 149, 150, 154, 155, 156, 158, 159, 160, 161, 162, 163, 164, 165, 166, 167, 168, 170, 173, 174, 175, 177, 178, 179, 181, 182, 183, 184, 185, 186, 187, 188, 189, 191, 193, 194, 195, 196  ( Total 98 wards 2.50 crors for each ward)","SRI RAGHAVENDRA CIVI",9845183166,,"First and Final",000217,10-Nov-2020,000048,30-Jul-2021,000147,31-Jul-2021,,"           ","Under Process in Addl. Commr. Finance",5744000,"Fifty Seven Lakh Fourty Four Thousand ",571832,"Five Lakh Seventy One Thousand Eight Hundred Thirty Two",5172168,"Fifty One Lakh Seventy Two Thousand One Hundred Sixty Eight"
